{
  "proposal_id": "99999999-9999-4999-8999-999999999999",
  "trip_id": "11111111-1111-4111-8111-111111111111",
  "base_trip_version": 1,
  "status": "validated",
  "title": "Move Senso-ji later in the afternoon",
  "summary": "Shift the visit by one hour without changing the fixed flight reservation.",
  "reason": "Example of an AI-generated but not yet approved itinerary change.",
  "operations": [
    {
      "operation_id": "aaaaaaaa-aaaa-4aaa-8aaa-aaaaaaaaaaaa",
      "operation": "move",
      "target_type": "trip_item",
      "target_id": "88888888-8888-4888-8888-888888888888",
      "from": {
        "date": "2026-10-20",
        "start_at": "2026-10-20T15:00:00+09:00",
        "end_at": "2026-10-20T16:30:00+09:00"
      },
      "to": {
        "date": "2026-10-20",
        "start_at": "2026-10-20T16:00:00+09:00",
        "end_at": "2026-10-20T17:30:00+09:00"
      },
      "reason": "Keep the morning less rushed after arrival."
    }
  ],
  "validation": {
    "valid": true,
    "validated_at": "2026-09-17T01:00:00Z",
    "hard_constraint_violations": [],
    "soft_constraint_warnings": [],
    "conflicts": []
  },
  "impact": {
    "travel_minutes_delta": 0,
    "walking_km_delta": 0,
    "estimated_cost_delta": 0,
    "currency": "JPY",
    "affected_days": ["2026-10-20"]
  },
  "generated_by": {
    "type": "ai",
    "model": "planner-agent"
  },
  "created_at": "2026-09-17T00:55:00Z"
}
